Coding,Message
Action,We are asking every shop around the BAY ISLANDS to do at least one dive on Sunday that is a specific cleanup dive!
Information,"Turtle meat is still consumed throughout the island and people use nets and spears to catch them. This net was most likely from Crawfish Rock as we have had numerous reports of them from community members. There are undoubtedly dozens more turtle nets being used around Roatan so we ask all boat owners to keep on the look out for lines of small floats inside lagoons , indicating a net. One can only imagine how many turtles have sadly died in this net but thankfully it has now been destroyed and can no longer kill our hawksbill and green turtles."
Information,"these guys are all alive and as well as can be hoped. to ensure that the iguanas don't escape, they rip out the nail from each foot and tie them together, using the tendon as rope. Not very nice for the iguanans but at least these guys were all well enough to scamper off into the bushes once released"
Community,DOLPHINS!!! a few Hundred heading East from Gibson Bight!!!\nKeep us updated if you see them :)
Action,"Our Director, Giaco Palavicini, is in Mexico sharing the work he has done for not only the benefit of Roatan but for Honduras and the entire region! \n\nWe are so proud of him for taking the Roatan Marine Park to the next level! \n\nIf you happen to be in Playa de Carmen today at 6pm you should check him out!! "
Information,"We investigated the boats and please know they had a permit but not one from the Roatan Marine Park...However, the vessel had been issued a permit no. 092-2012, by the Secretaria de Agricultura y Ganaderia that house the Fisheries Department, from the mainland, allowing them to do so, therefore going against the regulations stated in the current and legal management plan."
Community,Thank you to everyone that came out to support!!
Community,"LandFillHarmonic! Yet another thing we can do with what others deem ""garbage""\n\nhttp://www.upworthy.com/watch-the-first-54-seconds-that-s-all-i-ask-you-ll-be-hooked-after-that-i-swear?c=reccon1"
Action,captains meeting for the lionfish rodeo tonight at Blue Marlin at 6pm
Community,"Dian Lynn what is your email address, we will send you our logo!"
Community,"The RMP thanks for the support of our members and supporters and would like to give a special thanks in this occasion to the South Side Supporters that helped in  reactivate the South Side RMP. \nBarefoot Cay and Dive Shop, Coco View and Dock Side Divers and Subway. We would also want to thank for the permanent care, love an patrols on the French Cay are of Mr. Sherman Arch."
Community,"Ever thought about snorkeling the mangroves?? There are some wonders that can be found if you just have a little patience and a keen eye! \nGeotourism is alive and well, Please check out Go Blue Central America Geotourism for more ideas like MANGROVE SNORKELING on Roatan!"
Community,It's a date
Action,Our photo competition is coming up... Don't forget to submit for a chance to be in next year's calendar!
Information,It our time to enforce this great step forward to make a real effort to protect our sharks 
Community,It sure is!!
Community,It is a flamingo tongue :) One of the most photogenic mollusks out there :)
Community,"We are looking for Secret Shoppers for the The Bay Islands Responsible Seafood Guide... If you are going out to eat in the next few weeks, please let us know!"
Community,I will be making the petition in the next couple days and checking on the validity of an online one. Thanks for the support!
Community,Janeth son pepinos. Amilcar check the comment towards the beginning to answer your questions about what they are doing with them.
Action,"Photo contest deadline has been extended to this Fri., Aug. 7 due to technical difficulties."
Community,"If you have problems opening it, go to our webpage www.roatanmarinepark.net and click the link for the newsletter"
Information,It is a shame that so many have died this season. We are investigating their reproductive cycle and the very real possibility of survival of the fittest.
Community,We can arrange it for the US and Canada.  Anywhere else takes a long time and is costly!
Action,New bags FOR SALE!!! Only LPS 100!!!
Action,"It's amazing. Too many auction items and prizes coming in. It's getting very exciting. Place your bids now, or see you at Bananrama for the live auction!"
Community,Did anyone get a copy of Diario el Tiempo yesterday??? Pages 6 and 7 are about the Bay Islands Coastal Clean Up :) We would like a copy :)
Community,David Henriquez we need ppl now to help with a conch nursery...
Community,Sure we shared this months ago. Why wait for those Coca-Cola packs to get here?? \nMar Leaders where you at?? :)
Community,Please check out the differences at\n http://www.starfish.ch/reef/marine-turtles.html
Community,"Now, that is what a beach cleanup is supposed to look like!!"
Action,"Good Morning All, \nJust a quick reminder to all diveshop owners and managers. Please check your email for an invitation to our meeting tomorrow night.\n If you have not received the invite please PM us for more info. \nWe will be discussing rules and regulations of the National Marine Park and what we can do to reduce the amount of boat to diver/snorkeler incidents. \nThanks, \nRMP staff"
Community,CALL IN TO ROATAN RADIO 101.1 TO WIN A FREE RMP CALENDAR... ALL YOU NEED TO KNOW IS WHO WON 1ST PLACE IN OUR 'INVERTS' CATEGORY.... \n\nPhone\t9796-1760\nEmail\troatanradio@gmail.com\nWebsite\thttp://www.roatanradio.com
Action,WEST END we are meeting at Barefeet Bar at 8am and walking and cleaning as we go!! There might be a little extra perk at sundowners @ 5 for those that help out! 
Information,6 more iguanas confiscated over the weekend. These guys were taken off kids on the West Bay road and relocated in Gumbalimba where they should be safe from becoming a stew
Community,We have 7 plastic bottle and aluminium can recycle bins available to anyone willing to take charge of them. They may be used for everyday trash so you may have to clean them once in a while. We can deliver if you don't have a vehicle!
Information,Take advantage of slow season!!
Community,"Sarah and Audray, This kids were lost at sea for 4 days. They were found on the last sweep of the search 60 miles NW of Roatan."
Community,"Our Park Rangers are getting ready for everything, this weekend they received their Emergency First Response course. Well done guys!"
Community,"In semana santa our team work hard side by side with Cruz Roja, Bomberos, Police, Marina Mercante, COPECO, Hospitals and Municipality to reduce the risks of semana santa here are some photos of that effort."
Information,lionfish ribs...
Community,https://www.facebook.com/events/1444825592481683/
Community,"We would like to thank our latest Individual Gold Members, Christopher Dye and Dan Szpak. As a dedication to  their dog which sadly passed away, the latest dive site in Sandy Bay is Zack's Patch, located just to the east of Peter's Place. Sitting at 40ft right next to the shallow wall, there are a host of swimthroughs and channels to keep you busy."
Information,"Semana Santa Operative meeting at the Municipality... Proud to be a part of safety during Semana Santa! \r\nIf you have any Health (fire, police) related Emergencies please call COE (Operation Center for Emergencies) @ 2445-1972 or call Roatan's Vice Mayor Elsa @ 9986-6626\r\nIf you have any Marine related Emergencies call our Director Giaco @ 3171-5982 or our office @ 2445-4206 or 4208"
Information,Paperwork is signed and our new Board of Directors are ready to go! Everyone is really excited about the first board meeting taking place next week!
Action,We are actively looking for a coordinator for Bay Islands Coastal Clean Up for the West Bay area... please contact Christi @ 3289 1213 if you are interested!
Community,"Clay Fowler I will give you a bit of background. There is an Acuerdo (002-2004 art. 35) that states that no plastics, bottles, bags or packaging shall be introduced into The Bay Islands without the necessary removal efforts in place. As of June of this year we have had the 4 biggest supermarkets ban plastic bags. They are now slowly and surely bringing them back as there are no municipal sanctions in place, even though we have had this Acuerdo since 2004! \nWe, the RMP, want to show the municipality the support this initiative has from the communities. \nSo I ask again... would you sign a petition to save our ecosystems?"
Information,"As promised to our English-speaking friends, fans and supporters, here is: \xa8The Lionfish: Serious Threat to Roatan\xb4s Reefs\xa8 (English version) which also will be aired on local television"
Action,"Check back regularly to see the submissions for this year's photo competition.  Winners will be announced in August and featured in the 2010 RMP Calendar, which will be available in late Sept. \n\nNames of the submitters will not be shown prior to judging so as to not bias the results."
Information,"The graph indicates sale of the ""user fee"" by dive shops and businesses within the SBWEMR in January 2014 and does not include user fees on consignment, memberships, t-shirt sales or lionfish licenses. We would like to thank all our supporters and highlight that without you promoting our conversational message, we would be unable to continue protecting Roatan's reefs."
Community,We were tagged in this beautiful seahorse photo by Gary Miller from Barefoot Divers! Thank you Gary for this week's Photo of the Week!
Community,Awesome! Thanks Scubaba!!
Action,Entries to have people's photos in the 2010 RMP calendar
Community,"This is an oversight committee to ensure the proper execution of all the programs within the National Marine Park.  Specifically for the RMP, being a part of this Committee allows us to be more involved and have our voice heard by the main key players throughout the Bay Islands!"
Action,Ladies and Gentlemen... the first 5 ppl to bring in a bag full of marine trash (plastic) will be given one of these bad boys :) Please contact Christi upstairs in the office or at 3289 1213 to redeem your prize!
Information,They are all safe. Minor injuries if any. They have been taken to the hospital for check ups.
Information,"Well Chris, the Roatan Marine Park has been and is still very involved in improving Honduran Environmental Laws. Things don't change over night in first world countries so you can imagine how hard it can be here with lots of conflict of interest in many cases. The SAD photo you post its a true reality and we have extensive awareness programs with kids and we are just starting to create an awareness program thru diving and its not just something random this is the way for many local people to realize their treasure.  But the true strength of the RMP comes from the united effort of Hotels, Dive shops and other stake holders that depend of the Island. And let me just rephrase united. We have touched all the government levels that are in charge of actually punishing this acts and in this year we have had success on the response and prosecution. Strong fines had been given and some projects have been stopped. But as I mentioned before we need to work United and we cant stop all of the bad things that affect the reef but we definitely make a difference.We want to stop problems like this every one should together as part of this Island. If someone has a report contact us as soon as you can and we will gather information or  detain and then send it to the government office that has the responsibility prosecute, we will follow up. If you want to know more about all the activities, projects, funds, and government relations please contact us, or come to our general Assembly which will be in March and will post the exact date on our Facebook page. All together we make the difference not alone."
Action,2nd Annual Bay Islands Coastal Cleanup
Community,RESCUE TURTLE COUNT!!! \nHow many turtles to do you see?
Action,"You guys remember the turtle release that had to be re-scheduled? Well, TODAY IS THE DAY!!! The turtle is en route and will be released at 5PM in Half Moon Bay in front of the Marine Park office!!! Bring your waterproof cameras and swimsuits!! :)"
Community,"One is a simple data base of everyone that has been licensed to hunt lionfish. We have photos, names, contact info, spear number and expiration date. The other is a little more complicated; it's our patrol database which would serve as a back up to one that we already share with other organizations. It needs to have names,ages, photos, location, techniques and cross referenced in some way so we can search for offenders based on criteria in order to write reports."
Action,"As some of you may have noticed we have been doing turtle research with proTECTOR (http://www.turtleprotector.org/). They have been here for a couple months and would like to share their findings with all the diveshops of Roatan.\n \nWe will be sharing this data on FRIDAY, this Friday, in the classroom of  Roatan Oasis starting at 5:30PM! \n\nChristian and Dustin will also be visiting your diveshop to collect any forms you have filled out and to let you know about it! \n\nHope to see you there! "
Community,Thanks to everyone that participated in the cup slogan contest all those months go. \n\nThey have arrived; we have paper cups!\nLps 650/box of 1000 or Lps 65/hundred\nFREE DELIVERY! \n\nDo your part to help Protect Roatan's reef. \n NO MORE PLASTIC in the sea!!!
Action,The competition finishes on Sunday so get snapping
Action,If you're traveling to San Pedro and need a hotel this is the way to go! Buy your PromoDias card at our Eco Store in West End for only 400lps it will pay for itself in no time! \nFor more info please call 2445-4206 or visit www.promodias.com
Community,"Betty Lopez and Anna Samud if you are trying to submit these photos please send them to photosrmp@gmail.com and label each one with the Photographer's name, Photo's name, Photo location and category. These will be the only late submission accepted. Please submit them no later than tomorrow."
Community,Photo courtesy of Alex Harper-Brown
Community,Thank you for letting us know you received your package! We are very happy you got it! :)
Community,There is no online store as of yet. You can make orders through here and pay via Paypal and we will get them to you as soon as we can.
Action,"Do you live in the Mesoamerican Region? Have you ever thought about why more things don't get done to protect the mangroves? Maybe you have a project in mind and just need some help developing it! If so, THE TIME TO DO SOMETHING IS NOW!!! \n\nThe MAR Leadership Program is now open for submissions! This year's theme is Mangrove Valuation and Conservation! \n\nFollow the link for more information! Let's work together to make a difference! \n\nhttp://liderazgosam.org/general-information/?lang=en"
Community,Website need a little spicing up? Maybe just need a little online marketing help! Check out the Go Blue Central America YouTube page for their free webinars! https://www.youtube.com/channel/UC8Ck68990D9WAL1n4l4im1w
Information,"These were published in La Tribuna on Sunday. Great write up on our lionfish efforts, illegal seahorse trade and getting the word out there!"
Community,More great videos by great people!! Awesome Job Katie and Michael! \n\nhttp://valueofvolunteering.org/videos/episode-one/
Community,"Beach Cleanup in Half Moon Bay! Thank you to Subway Watersports Roatan, Ocean Connections, West End Divers, Policia Nacional, Cannibal Cafe and so many others that came out to Half Moon Bay this morning! If anyone has anyother photos please feel free to tag us! :)"
Information,"We stopped the first big boat with cayucos in french cay thanks to the support of the community of French cay and the problem is that who coordinates the sea cucumber trade has a research permit but it only applies for the main land Honduras fisheries, not on the Bay Island because it has been declared a Marine National Park. Still unfortunately there is a lot of pressure of Asian market and this is and will be one of our strong problems on the Island."
Community,Not sure but we will ask the Bay Islands Coastal Clean Up :)
Community,"We would like to thank Melanie Merlino for once again choosing to support the RMP by becoming an Individual Gold Member. Her new dive site, named by her son, is B's Deep, located adjacent to a channel between the Odyssey wreck and Spenser's Rose Garden. The mooring is in 30ft next to a huge crack which leads to the shallow reef crest. To the west you have steep walls running from 20ft down to 100ft while in front you have a gently sloping reef that heads off into the deep. Thanks again and happy diving"
Community,"Yes, West of the Methodist Church in Flower's Bay"
Information,"Hopes everyone enjoys the beach over semana santa, but would like to remind people to take their trash with them and avoid standing on the reef"
Community,Thank you to our great volunteers for all of their help making beautiful signs and patrolling our beaches. We were lucky to get some great artists this time! Thank you!
Information,We will be posting photos and prices of the final products in the next few days and can reserve as long as pick up is timely! :)
Community,"Sign making Friday! Thank you Diamonds International, Tiani Forbes and Frances Wong for doing a great job! \nBe on the lookout on Roatan's beaches for our new signs :)"
Community,"Thank you to everyone that came out to support the Lionfish Cookoff! \nWe would like to that the participants! Vintage Pearl, Celeste's Island Cuisine, Chubby Hubby, Mayan Princess and Turquoise Bay!\n \nWe would also like to announce that for the 2nd year in a row MAYAN PRINCESS took home the crown! Turquoise Bay was a close 2nd and Vintage Pearl took home 3rd! \n\nWe look forward to more events like this in the future!"
Community,Sorry it's crooked!
Information,Here is the approximate location of where the boat with the 8 passengers where found
Information,"Sea cucumbers, named for their resemblance to the vegetable cucumber, are echinoderms and are in the same phylum as starfish, sea urchins, and sand dollars. They are found at every ocean depth and worldwide there are approximately 1250 species. They can be anywhere from 3 millimetres to 1 metre in length but are typically 10-30cm long. \nSea cucumbers serve a useful purpose in the marine ecosystem as they help recycle nutrients. They are generally scavengers, feeding on decaying organic matter, however some feed on plankton. Therefore they play an integral part in marine ecosystems, almost similar to that of lobster and conch, and cannot be disregarded as being unimportant. \nFor centuries sea cucumbers have been harvested for human consumption with some species cultivated in commercial aquaculture systems. They are mostly exported in a dried form, but a small quantity of fresh and frozen sea cucumber also enters into international trade. Nearly 90% are consumed in Southeast Asia and the Far East and in general consumption is associated with high quality dried and prepared/preserved seafood such as shark fins, abalone and other shellfish. In Dalian, the largest sea cucumber trading hub in China, the industry is estimated at $1.6 billion per year, meaning global estimates are much greater. \nIn the past year, with the closure of the lobster diving fishery In Honduras, fishermen have been looking for alternatives and have heard of the possible riches in harvesting sea cucumbers. There have been numerous cases throughout Roatan of boats packed full of free divers collecting sea cucumbers and fortunately, on several occasions we were able to intervene and release the sea cumbers.  According to the Bay Islands Management Plan, it is illegal to remove and commercialize shells, hard and soft corals, seas cucumbers, starfish, sea urchins, seahorses, sponges, turtles, sharks and all sub products. This law is for the whole of the Bay Islands, therefore we ask that you report any boats or individuals collecting sea cucumbers so we can collaborate with the authorities and stop this from happening."
Community,"If you are asking because of the audio we made for the radio, it was made to be used on all 3 islands. It is still brought to you by the RMP and USAID but you could call BICA Utila or the UMA in Guanaja!"
Information,Half Moon Bay is a no wake zone... all licensed water taxis know this. It is hard to stop completely when we don't have enough patrols and there are so many people using unauthorized water taxis.
Action,Want to help us protect this beautiful reef? Why not visit www.roatanmarinepark.net and become a member. Your help means we can increase our patrols and ensure this reef is well protected.
Information,"The graph indicates funds generated from the sale of the ""user fee"" and membership payments by dive shops and businesses outside the SBWEMR between January and May 2014. It does not include user fees on consignment, t-shirt sales or lionfish licenses. We would like to thank all of our supporters, big and small, and highlight that without you promoting our conservational message, we would be unable to continue protecting Roatan's reefs"
Action,There are only a few days left to send your best photos in to have the chance of them appearing in the RMP 2011 calendar
Action,"www.roatanradio.com will be replaying an interview with the Marine Park's Executive Director at 10am Roatan time, 1hour 40 minutes from now. Listen in to the 2 hour show about what's been going on at the Park and plans for the future"
Community,"As voted on by the Friends, Members and Supporters of the Roatan Marine Park this Goatee Blenny has won 2nd place in the BEST FIND category! Congratulations @alex harper-brown"
Action,PHOTO CONTEST CLOSES TOMORROW @ MIDNIGHT!\n\nOne more day to share your photos with the world! Submit your photos before tomorrow the 15th of July at midnight!
Information,"For all Visitors and Residents alike that have been and would like to swim with the Whale Sharks. And for the dive professionals around who have decided that it is ""OK"" to touch these sensitive creatures We would like to remind everyone about the LAWS of Whale Shark swimming :) Please be on the look out for these posters in a diveshop near you! If you would like a poster please contact us @ info@roatanmarinepark.net!"
Information,Ones confiscated in the last week!
Community,"Thank You to everyone that came out last night! We feel great having given out copies of the Management Plans (Bay Islands and Cordelia), Normativas, HRI Report Cards and RMP videos! \n\nAs promised here is our contact info! \nOffice numbers 2445-4206 and 2445-4208.\n Giaco (Director and Patrols) 3351-8591. Christi (Community Development) 3289 1213. Nick (Infrastructure) 3320-6940. Marta (Administration and Retail).\n\nPlease let us know if there is anything we can help you with!"
Information,"Normativa Tip!\n\nUse section 11.2 to protect the safety of your business and that of your staff.\nIn particular sub-section e) Dive guides have the right to refuse the participation of any diver if it has been determined that they may be a risk to them self, others or both. \n\nThese laws are for the safety of all... don't forget to read them thoroughly!"
Information,"All of the Iguanas where alive, a little banged up but still active as we set them free"
Community,For the record THIS IS NOT ON ROATAN! If it was you would see us all out there taking photos and videos! :) :) \nKate Rister Thank you for clarifying common misconceptions! Your passion shows through your words!
Action,We will have a Patrol Boat Water Taxi Shuttle (Don't worry the other boats will still be patrolling!) leaving from Coconut Tree Dock on the top of the hour starting at 1 and ending at 5! We will then have a bus shuttle leaving from the entrance. We are still figuring out the times for the bus but it will be frequent! Keep eyes here for more updates :) :)
Community,That sounds AMAZING! Thank you so much!
Action,Hmmm... Polo's water board office Behind Mares?  We've been here since 430. It's not too late come on by!
Community,"Anyone on island  qualified to teach 7th-9th grade science, 10-11 grade Biology and Chemistry?"
Information,"Roatan could be the leader in Central America for this type of initiative! We need everyone to ban together, all citizens, tourist and cruise shippers to join the fight! Join the fight against plastic! THE TIME HAS COME TO SAY,  ""NO MORE PLASTIC ON OUR REEF!!!"" \n \nhttp://www.plasticbagfreeday.org/"
Community,Can you imagine a Plastic Bag Ban on Roatan? I can! \n\nhttp://www.mnn.com/lifestyle/responsible-living/blogs/interactive-map-shows-plastic-bag-bans-around-the-world
Community,Thank you Ian Drysdale for this beautiful shot of Cordelia!
Information,Only best find is judged by the public
Community,"We would like to thank our Gold Individual member Gerald Forney who purchased the new dive site Lambie Pie, located just to the west of the channel by Man of War Key. The mooring is sitting in 25ft right on top of the wall which leads to a deep sandy basin"
Community,Call Christi if you're interested at 3289-1213. It would nice to organize an Earth Day event with the school kids! Maybe with some of the collected materials from the clean up!?
Information,"The graph indicates funds generated from the sale of the ""user fee"" and membership payments by dive shops and businesses within the SBWEMR between January and June 2014. It does not include user fees on consignment, t-shirt sales or lionfish licenses. We would like to thank all of our supporters, big and small, and highlight that without you promoting our conservational message, we would be unable to continue protecting Roatan's reefs"
