Coding,Message
Community,Settled! This is the photo of the week! Thank You to Derek Laun for this great photo!!
Community,The numbers are in and we challenge you aim high! Graphs of who are the front runners are coming up... See where you stand and set your goal a little higher for March! Great Job to everyone!
Information,There was spawning last night of Montastraea faveolata or mountainous star coral! Photos will be posted soon!
Information,"There is no such thing as ""Away""!"
Information,Good kind of dolphin shows... rescued and properly fed
Community,Ew... ok thanks. We will be over today to fix her up
Information,Final count on LIKES= 8
Information,"Our latest addition to our Individual Gold Member list is Peter Schaefer who named his dive site ""SchaefTown"". Located close to Green Outhouse in Sandy Bay, the mooring sits in 45ft between a deep sand patch and the wall"
Community,Amanda Walkins thanks! Will you please ask them if they see it again to let us know right after so we can go search... unfortunately he can be any where after a couple of hours :/
Community,4-Aug
Information,We are always sorry when conservation efforts are thwarted... The UMA we referred to on Jan 31st is the Unidad Ambiental de la Municipalidad...
Action,"Christmas Baskets... Special Christmas Baskets... \r\n\r\nSave up to $10... Great items in each and every one! Repellent, Tea, Hot Sauce, Coffee, Rum Cake, Spices, Eco Books, Book Marks, Re-usable Bags, Soap, Jewelery, RMP Mugs, Coasters, RMP Stickers, RMP Pens and much much more... \r\n\r\nCome down to our ECO Store... We have something for everyone!"
Information,http://www.windfinder.com/forecast/isla_de_roatan \nThe forecast is calling for strong winds starting this Thursday. Derby will be postponed til further notice. Sorry for the confusion but you can't fight the weather!
Information,Looks like there is weather brewing! http://www.windfinder.com/forecast/isla_de_roatan
Action,"Still looking for someone that can help us create 2 databases, basic databases. Anyone out there that can help us?"
Community,"We would like to thank everyone that competed in this year's photo competition. This calendar contains the top photos from each catergory, however there is space for 9 additional photos in the calendar which should be out in the next few months. Congratulations to all those that won and to everyone who took part."
Action,Entries to have people's photos in the 2010 RMP calendar
Information,"Today while patrolling near Turquoise Bay, our Park Rangers spotted an empty dory and a man in the water. Upon inspection, we found 7 undersized lobster, 5 live conch, 19 speared fish and worst of all a live, speared juvenile green turtle on board. The dory with all the product was confiscated, along with a speargun and a hook rod which were found in the water. The turtle is currently in Maya Key but it doesn't looking promising as it was shot in the lung. A case will be filed regarding the incident and we will have to work further on relations with the fishermen from Punta Gorda"
Information,"Good Morning all, \nWe are heartbroken to inform you that she did not make it.\n\n She seemed to be doing well but had a secondary infection within her carapace. With limited facilities on island and limited funds to send to the states she died at Maya Key animal refuge last week. \n\nWe thank everyone that was involved in the rescue and care. Hopefully the person responsible will think twice (especially since we confiscated his spear!) before doing this again!"
Information,"The graph indicates funds generated from the sale of the ""user fee"" and membership payments by dive shops and businesses within the SBWEMR between January and March 2014. It does not include user fees on consignment, t-shirt sales or lionfish licenses. We would like to thank all of our supporters, big and small, and highlight that without you promoting our conversational message, we would be unable to continue protecting Roatan's reefs."
Information,shark liver is very common unfortunately. Thought to cure many different ailments. :(
Information,Melissa Ochoa Rolinger They do look very similar but these hatchlings are Hawksbill. You can tell by the scutes. :)
Community,"Please follow the link to attend the Tedx event on July 25th. Our director, Giaco Palavicini, will be a speaker!!  \nhttp://www.tedxtegucigalpa.org/"
Information,1 of 2 Bonus Categories
Action,We still have canvas ones for sale for 40lps or free with a $20 purchase!
Community,I can't seem to find it.. would you please forward it to christi.etches@roatanmarinepark.net and just for good measure christianne.etches@gmail.com too
Action,You can take action by visiting www.roatanmarinepark.net and donate to our marine protected area. Help protect the reef for the future.
Information,"Socioeconomic Monitoring for Coastal Management workshop, Corozal, Belize. This workshop was organized and funded by Belize Audubon Society, Zamorano, CEM, NOAA Coral Reef Conservation Program and GCFI.\r\n\r\nWe are getting simple and visual tools to better approach the communities so we can achieve a united effort to protect our Island"
Community,We also organize beach clean-ups!!
Action,"Ever wanted to see how many ways lionfish could be prepared by some top Roatan chefs, now you can? Come to San Simon this Wednesday and see how Buena Vida, Rendezvous, Mayan Princess, Bight on the Beach, Lionfish Louie's and one or two more restaurants serve up this invasive species. You will be the judges so get there 6pm as there will only be 100 plates."
Information,I think finding the correct blue tiles for the puzzle may be rather infuriating
Action,You can vote now on the Best Find Category... album was just loaded!
Community,ED Ward what do you mean?
Community,That would be a great help!
Information,"Working with the navy, our patrol boat traveled east early yesterday morning to catch any unsuspecting poachers off guard. We were fortunate enough to confiscate a large monfilament net close to the golf course and some hook rods in the same area. It's been a good week regarding nets for the RMP patrols"
Community,"That may be the case but, we also need  to think of where our trash goes! It's a never ending cycle of passing the buck!"
Community,I will pass the message on to Nick and Giaco. Hopefully they can help sooner rather than later. Will you please inbox your contact information :)
Action,"Thank you to everyone who made it out to BananaramaDive Beach Front Resort for the announcement of the 2014 Photo Competition Winners! \nFor those that could not make it and/or are off island you can click on the link below for the presentation of the winners! \nThank you again for all the submissions and love! \n\n<iframe src=""http://prezi.com/embed/pn75ls6l7nqp/?bgcolor=ffffff&amp;lock_to_path=0&amp;autoplay=0&amp;autohide_ctrls=0&amp;features=undefined&amp;disabled_features=undefined"" width=""550"" height=""400"" frameBorder=""0"" webkitAllowFullScreen mozAllowFullscreen allowfullscreen></iframe>"
Community,"Laurence Hegarty, Hopefully none are doing this. \nWe ask that EVERYONE that pays the user fee receive a bracelet or tag. \nIf it's not offered to you please ask for it!"
Information,"Ever wondered about the anatomy of a sea turtle? Well, here you go!"
Information,"The lionfish are still winning at this point but, we along with all the divers around the Bay Islands are really giving the reefs a fighting chance. We have issued over 300 lionfish spears (from 2010 til now) and can see a big difference!"
Community,Pedro Aquiriano si tienes dudas de lo que realmente hacemos mandanos un correo a info@roatanmarinepark.net. \nNo es el lugar adecuado para discutir esas cosas pero asegurate que nosotros estamos haciendo nuestra parte. \xbfSe puede decir lo mismo?
Information,Our office numbers are 2445-4206 & 2445-4208. To report:  poaching incidents call Giaco at 3351-8591; marine infrastructure call Nick at 3320-6940 and for community/ education based activities call Christi at 3289-1213
Action,"Looking for stylish new clothing? When you buy from Prawno, they will donate to the RMP"
Community,Absolutely amazing video!!!
Information,"The graph indicates funds generated from the sale of the ""user fee"" and membership payments by dive shops and businesses within the SBWEMR for 2014. It does not include user fees on consignment, t-shirt sales or lionfish licenses. We would like to thank all of our supporters, big and small, and highlight that without you promoting our conservation message, we would be unable to continue protecting Roatan's reefs. It was a great 2014 and we hope that we can increase support in 2015"
Community,"This is a small group, selling at small outlets without the use of pesticides and poisons. We don't question what we buy in big supermarkets as much as we should. We are carefully selecting locally produced products that are sustainable and providing economic development to local communities. Hopefully it will go well as it seems to be so far."
Action,"All are invited to James' Farewell Celebration, tonight @ Land's End.  7 PM."
Information,2 juvenile hawsbills which have been in Maya Cay were released 
Community,We can get them on their way next week! Please inbox us your address and we will send you possible payment options!
Community,Will anyone that is shopping at Eldon's Supermarkets please take a photo of the plastic bags they are now giving out again!
Action,Sunday we are meeting at the GAS STATION at 9!!! Be prepared for the mangroves!!
Action,Come visit our Eco Store in West End
Community,"What are the three basic principles needed for guaranteed long term sustainability? Environmental protection, economic growth for all stakeholders, and overall respect of the socio-cultural authenticity of the host community. Learn all about it at Go Blue Central America Geotourism"
Action,Here is an online petition for a Plastic Bag Free Roatan! If you live on Roatan and would rather sign a paper copy please stop by the RMP Eco Store to sign it! \n\nIf anyone would like to help gather signatures your help is more than welcome! Call Christi 3289-1213 to pick up a copy! \n\nhttp://www.thepetitionsite.com/750/652/699/we-need-a-municipal-ordinance-for-a-plastic-free-roatan/
Community,"Check back regularly to see the submissions for this year's photo competition.  Winners will be announced in August and featured in the 2010 RMP Calendar, which will be available in late Sept. \n\nNames of the submitters will not be shown prior to judging so as to not bias the results."
Community,That is great Jacques! Send me an email christianne.etches@gmail.com so we can talk about this more :)
Community,She is set.. Thank you for helping us out on such short notice!
Community,"i don't think all dive shops will be so open with their books so to get an accurate % would be extremely difficult. Only people who ""like"" the Marine Park can see these figures and can always email at info@roatanmarinepark.net to get an unbiased response regarding dive shops. This chart is used to congratulate all those business that sell the user fee and are members. With so many shops and with month 4 of the year already gone, you can see trends in who do and don't sell the user fee."
Community,Bridgette 'Stingray' Gower The article says southeast china
Community,Hal Thanks for your support and just to clarify we work with the Honduran Navy and the National Police!
Action,Are you a dive professional interested in turtle monitoring?  There are a lot of empty chairs... come on down!
Community,We have 13 in West End and 7 in West Bay... they will participate but only one has confirmed!
Community,Newest POP Open Water Diver!! \nCongratulations Guillermo Pastora! \nThank you Las Rocas and Peter Coyne!
Community,"Yes, that's what we think. They tied it to be able to find it later"
Information,"through the months of February and March, receiving a total of 367 lionfish reports, of which 287 were killed. Remember, if you don't log the sightings or kills, we will never know"
Information,"Looking for a humane way to catch a pesky mouse??? Try this homemade, not to mention cheap, trap!"
Information,"LARGER FORMAT FOR THE TOTAL RAISED FOR RMP FROM JANUARY TO 2012 INCLUDING: DONATIONS, MEMEBERSHIPS, AND BRACELETS."
Community,"According to CITES you are not allowed to take more than one shell across an international border. Also, according to the management plan of the National Marine Park you cannot, CANNOT, commercialize, (buy, sell or trade) them.  Most will get confiscated upon entry into the US or Canada. We advise people not to waste their money nor deplete our resource."
Community,"Not so friendly photo of the week! But as much of you may have noticed in your newsfeed, the shark slaughter has begun. Please do what you can in your community, sign a petition, let any restaurant that serves shark fin soup know why you will not eat in their establishment. Every little bit helps and hopefully we can avoid the unnecessary slaughter!"
Action,these are only shots from our first few entrants. We are anticipating a great competition and are looking forward to receiving a wide array of photos. Please spread the word and send your photos in!
Information,hook and line fishing is permitted within the protected area. it is a multi use zone and we would prefer fishermen using the dive moorings rather than anchoring
Community,When visiting the The Bay Islands Responsible Seafood Guide please LIKE!!!
Community,Keep your eyes open for baby seaturtles in the debris on the beach! There have been 2 found and cared for by RMP staff members and are now at Maya Key waiting for a clear day to be released!
Community,"Baleska, We agree with you and according to the law, every Honduran has a right to eat! But, this quantity is not for personal consumption. These species are vital species for maintaining the health of the reef and for TOURISM...Parrotfish, Goatfish, Lobster, Angelfish and let's not forget that this is the same case that speared the baby green turtle! It's all fine and dandy supporting people that need to feed their families but let's not compare apples to oranges with artisanal fishing (poaching) and commercial fishing that is supplying restaurants!"
Action,Only 2 weeks untill the 2010 photo competition draws to a close. \nSend your photos (maximum of 6 per entrant) to info@roatanmarinepark.net\nhttp://www.roatanmarinepark.com/news/2010-rmp-photo-contest/2010
Community,Sherry Allison Wyse the world needs to know that conservation is an ugly ugly line of work. If you like we can also show the slaughter of dolphins and whales but we thought that might be too much for one week. \nThe fact is that the fisheries are open worldwide. We need to do something about this!!!
Community,It's not photo competition time...yet.. but we are always looking for great photos. If you have some you would like to donate to us- please email them to info@roatanmarinepark.net- underwater or on land we can use them all. Thank you!
Community,Hermosa Beach California. The photo was taken in Half Moon Bay on Roatan :)
Community,It's the camera ;) No one will notice! How do you feel about the Coral Reef Alliance's suggestion?
Community,We will post the guidelines. You will be able to like as many as you want and fb will only let you like each photo once!
Information,Final count on LIKES= 36
Community,"there were several sightings over the weekend, a boat saw one on both the way to and from Cayos, and then the other was spotted near parrot tree plantation"
Community,Feel free to print out these pages to keep your kids busy while you're waiting on your next trip to the reef!!
Information,"With funding from a grant from NOAA, we have been able to license  more locals to hunt lionfish legally. These are guys from French Cay who have new spears and licenses so they can do their part in reducing lionfish numbers around the island. If you are in interested in getting licensed, please contact us"
Community,"Good Morning Gilbert,"
Community,Thank you for your support!\nBracelet sales and Memberships of January and February 2013\nSouth Side and East End
Information,"Mangrove Canal between St. Helene and Port Royal. We headed out there last week to help with a Mangrove Carbon Study along with Zolitur, Bica, UMA, HRI and OSU!  It was a long, muddy day!"
Community,"We would like to thank our ongoing supporters, Jim and Michael Jaskunas, who recently became Gold Individual Gold Members and named their dive site ""Rockies Reef"". The mooring is located just west of Mora Channel, opposite Lawson Rock. Sitting in 30ft and close to the reef crest, it's a long swim out to the deep. With intricate swim throughs in the shallows, this site is great for all levels of diver"
Community,Is this really him? What do you think?
Information,Save the Big Mommas :)
Information,Please click on photo for more info!
Information,"The belly meat is the most tender part of  fish, just like people pay big bucks for otoro, or tuna belly. The muscle in the pectorals almost have a soft shell crab taste to it and taste great deep fried. These parts are discarded when people fillet the fish so this ensures nothing goes to waste."
Community,Copyright Kelly Hale\r\nRoatan Marine Park  Annual Photo Competition 2011
Action,Please note that the photos of people stepping on the coral were taken by a RMP volunteer as they were doing in water education to snorkelers that did not receive an environmental briefing before heading into the water. We require photos of all incidents as we write up incident reports on our volunteer's impact in the park. The photos are to show that no matter what we do there is always more that needs to be done. We are constantly looking for volunteers to help with Beach Patrols and Environmental Awareness especially on cruiseship days. If you are appalled by these photos please come by the RMP during your next visit and donate a couple hours to our beach patrol... The reef needs your help as this is an everyday occurrence!
Community,"You can get lionfish at most of the members of the The Bay Islands Responsible Seafood Guide. In West End Coconut Tree, Earthmama's, Blue Marlin,and Cafe Escondido have them on their menus right now!! :)"
Information,These fish were not directly killed by human hands but were being washed on the beach and were being collected my kids on the beach until we warned them about the dangers and told them to stop!
Community,http://themindunleashed.org/2014/01/revolutionary-scuba-mask-creates-breathable-oxygen-underwater.html
Community,Thank you so much! You have continued to be awesome Jacques!!
Community,"Caribbean Cup Opening Ceremony and Lionfish Cook-off \nAre you hungry for a big fat juicy hunk of lionfish? Well then this is where you want to be!\nDon\u2019t miss out! \n\n6PM May 24th at San Simon, West Bay\nFirst come, first serve! \n\nWe will have the best restaurants on the island participating for the coveted award of best lionfish!! \nTry one, try them all! Tickets start at only $2 each!\n\nWe are proud to announce that the restaurants this year are all members of the \nBay Islands Responsible Seafood Guide! \nCome taste the cuisine of Cannibal Caf\xe9, Buena Vida, Turquoise Bay, and the reigning champs Mayan Princess... among others!"
Information,"When Jacques-Yves Cousteau first saw the blue ocean through a pair of glass goggles back in 1936, this where his thoughts:\n \n\u201cI was astounded by what I saw in the shallow shingle at Le Mourillon, rocks covered with green, brown and silver forests of algae and fishes unknown to me, swimming in crystalline water. Standing up to breathe I saw a trolley car, people, electric-light poles. I put my eyes under again and civilization vanished with one last bow. I was in a jungle never seen by those who floated on the opaque roof.\u201d\n \nThis is a gentle reminder that every time each of us ventures into our underwater jungles, we must behave properly, and demand that our companions do so as well, just as anyone would in an art museum \u2013 only seeing, never grabbing. Little by little, unsupervised people are impacting our delicate corals. \n\nIf we don\u2019t take supervision seriously, our submarine jungle will soon not look any better than an electric light pole in Coxen Hole!"
Information,"Here is the total income brought in from all the dive shops and resorts for the first 6 months of 2012, including tag and bracelet sales, memberships and donations. Well done to all the businesses who have brought in lots of funds.\n If you dive regularly on Roatan let your dive Centre know you appreciate them helping protect and conserve Roatan\xb4s beautiful Reefs.\n Remember your voluntary fee helps keep up the marine infrastructure the divers rely on safe and helps us continue our extensive education programs. \nWe need everyone's support more than ever. \nThank you."
Community,"This was in Thailand but it should act as a warning to us all that this could happen anywhere! Please do not feed any wildlife and if you are leaving your lionfish down below please do not directly feed the grouper, snapper, sharks or morays! We do not want the association between diver and food to become a problem here! \nhttps://www.youtube.com/watch?v=qVQ4m8hfx-4"
Information,"These are the entries for the best find category that people submitted, we didn't select them."
Information,Chromodoris kempfi (Purple Crowned Sea Goddess)
Information,"Hey now, we didn't design it :) Just shared an innovative idea! ;)"
Community,The numbers are in and we challenge you aim high! Graphs of who are the front runners are coming up... See where you stand and set your goal a little higher for March! Great Job to everyone!
Information,"Just a clarification, this trash is washing up from the open ocean! We know we have an issue on island and educational efforts are being made. The trash we are talking about now is not a product of our irresponsibility but, of someone elses."
Information,"This weekend is looking like a rough one! You still have time to fix your roofs, boat trailers and stock up on some yummy food!"
Information,"Samples have been sent to the labs and we are waiting on the results but, that may take several weeks!"
Community,Bravo agent EE83!! We look forward to hearing about your next hunting mission!
Community,Check out The Bay Islands Responsible Seafood Guide promotional video.. it's full of information on why it's so important to be a responsible when you are consuming seafood. Thank you Go Blue Central America Geotourism for all your hard work.
Community,Yes but this is a specific cleanup dive where you can focus on big things... and give your clients a sense of pride because they made a difference!!
Community,"We have Lionfish Licenses that need to be picked up! \nIf you see your name, face or know how to get a hold of any one of these fabulous hunters please let us know!"
Action,"Bring a Bag, get a Bag Challenge is still going on... we have 2 more gorgeous RMP bags to give away. All you have to do is bring in a bag of OCEAN PLASTIC (plastic from the sea) or MARINE DEBRIS!!"
Community,Grace Scott just send us a message when you have time and we will work something out! Thanks
Community,"Bill 'Sully' Sullivan, the other one however clearly states that it was taken from within the zones which we patrol which is from shore to 60 meters depth (Pretty much to the dropoff). \n""At 10-50 feet under rock and coral"""
Information,"Remember that in mainstream Catholic countries we have become accustomed to enjoy white meat during Holy Week, this has been proven by other organizations that within Honduras it is actually shark meat that is consumed!! \n \nRecuerde que en los pa\xedses cat\xf3licos, hemos acostumbrado a disfrutar de la carne blanca en la Semana Santa, esto ha sido demostrado por otras organizaciones que dentro de Honduras es realmente carne de tibur\xf3n.\n\nBe safe and make smart decisions!!"
Community,We regret to say that our phone lines have been down for about a month now and that is why we cannot process credit cards. We have been to hondutel more times than i can count and they are waiting on cable to run it again.\n  It is unfortunate that we missed a large donation as every penny goes towards conserving Roatan's reefs. Perhaps your guests would still be willing to donate using Paypal.
Community,Blind meaning only Christi knows the photographers.
Community,Sounds perfect!
Information,Diamonds International Honduras
Information,"The graphs simply show amount generated through membership and user fee sales. Obviously there will be a difference between the large resorts and the smaller shops. Some shops make the user fee mandatory, others sometimes offer it to their guests, while sadly a few do not mention the fee. Comparing % of divers who buy the fee would be a more precise method of measurement but that would be an impossible figure to acquire"
Information,"large nets will have white styrofoam buoys keeping it afloat, however the smaller ones will seem more inconspicuos as the floats are much smaller and often blue. Keep a look our for sticks stuck into the sand, seagrass, mud or even the reef which are used to keep the net in one place.  Straight or curved lines in the water may often indicate a net floating just at the water line"
Community,Special thanks to Martin Cabrera Deheza for the photo of a Sargassum Frogfish submitted for the 2012 photo competition.
Action,Only 2 weeks untill the 2010 photo competition draws to a close. View the attachment and get your photos in to have the opportunity of having your photo in a calendar\nhttp://www.roatanmarinepark.com/news/2010-rmp-photo-contest/
