Coding,Message
Action,They are .65 cents each. So lps 650 for/1000; lps 65/100. We have over 90k left :)
Information,Weather Update! \nGood Diving Days today and tomorrow... Weekend is looking a little choppy! Check out the Windfinder link for the details! \n\nhttp://www.windfinder.com/forecast/isla_de_roatan
Information,They actually recognize the RMP and the strategies we have done thru the years and for that exact reason we where invited to be part of the regional committee to build and apply the strategies as experts.
Community,Veronica at the big school in Sandy Bay (Addison School/escuela modelo) doing her presentation with 5th grade. By the close of this week she will have talked to EVERY GRADE!!!
Action,There is a new change in our Lionfish License Workshop! \n\nWe have been asked by many people to do workshops in the first days of their vacation so we will be offering 2 workshops on SUNDAYS one at 8AM and one at 10AM and throughout the week as needed with a minimum of 4 people. \n\nPlease sign up in the office upstairs :)
Community,"Multicultural day! \n""The man is the most senseless kind it worships a god and killing an invisible visible nature! without knowing that such killing is that this invisible god revered!"" \n\nIf a better translation is available please feel free!"
Community,"The lionfish film, 'Carribean Invasion', that was made last year here on Roatan, received an honourable mention in the Blue Ocean Film Festival awards list - Emerging Filmmaker category. \nhttp://www.blueoceanfilmfestival.org/film_catalogue.htm"
Community,We are also waiting on a photo :) Shel Thomas
Information,"Check out the latest additions to the dive moorings in Sandy Bay, Robin's Nest neat Gibson Bight and Deja Vu near Four Sponges. The Nest was named by one of our  latest Gold Individual members and is a great site for swim throughs. Deja Vu was purchased during our Birthday Party in the auction and has an awesome swim through directly below the mooring which takes you from the shallows all the way to the wall (>50m)"
Action,Come visit our Eco Store in West End
Community,"These photos were taken this morning, February 5th!"
Information,We found some progagules that they are sprouting at Nuna Academy!
Community,"This is an incredible video of brave conservationists and the product of ""smart"" poachers off of Tela on the North Coast of Honduras. \n*WARNING* Not for sensitive eyes or ears but we have chosen to share due to the efforts made by a few caring individuals and the big Green turtle that was saved."
Action,The Derby will be the first of 2012 and we hope for a great turn out. All registered teams must have the new licenses.
Community,Want to know more about the importance of mangroves? Watch this nice video about mangroves http://www.thenaturalnumbers.org/mangroves.html
Information,Bucho's
Community,Michael Sterken this is a pipefish.
Action,"Have you ever wondered about a discount card that would entitle you to great discounts throughout Honduras? Well, that idea has become a reality! \nPromoDias has AMAZING discounts in 40 businesses in Roatan, 20 on Utila and more than 150 more throughout the country. \nWith your membership you can receive anywhere from 15% - 50% off of great services in the following categories: Food, Shopping, Health and Beauty, Hotels, Tourism, Parks, Events, Transportation and Miscellaneous Services. For a complete list of savings please visit www.en.PromoDias.com\nThis great membership in your repertoire will pay for itself and then some within its first few uses. \nFor only Lps 400 you can pick up your PromoDias Card at the EcoStore at the Roatan Marine Park TODAY!  \n"
Action,Photo competition ends tomorrow. Hurry and send your photos to photosrmp@gmail.com
Community,They are no informants they are enforcement. French harbor has been under their supervision for years and they take pride of it.
Action,"It\u2019s that time of year again for the RMP underwater photo competition. You are invited to send 6 photos which can fall within any of the 6 categories. They must be taken by you, here on Roatan and underwater. Please attach a location, name and category for each photo submitted. The deadline is July 15th and all submitted photos will be available for viewing on facebook. The Best Find category will be judged by \u201cyou\u201d on facebook with the most votes winning that group. All other categories will be judged by independent adjudicators and the winners will appear in the 2014 RMP calendar."
Information,The species of the winning photos  will be listed in the calendar which will be on sale in late 2012.
Community,"David, the guy got away after he dropped his stuff and then proceeded to cut through private property and we suspect he got bit by their dog, as per reports!"
Community,"Roatan Splash Inn Roatan - Las Rocas Resort & Dive Center Barefoot Divers, Roatan Scuba Roatan Roatan Oasis Roatan Travel Guide Port of Roat\xe0n Infinity Divers Aqua Center Sundowners Reef Gliders Dive Center Ocean Connections Tyll's Dive West End Divers Coconut Tree Divers & Go Pro Caribbean Quality Time Divers"
Community,Please post or tag us in any photos you have of our 10th Anniversary! We unfortunately only managed to take a few!
Community,"We want to say a BIG THANK YOU for the great donation we have received from The School of Environmental Studies at the Minnesota Zoo who raised funds through ""penny war"" and chose to donate to us after learning about our community and environmental programs. Another BIG THANK YOU to St Georges School in Montreal for their great donation, they raised money over the past year by running several bake sales at their school and came to Roatan for a coral reef ecology course. We hope these students are inspired to become the conservationists of the future. Thank you again for all of your support."
Community,Are you affected by climate change? \nhttps://www.youtube.com/watch?v=cjuGCJJUGsg
Community,http://nas.er.usgs.gov/taxgroup/fish/Lionfishanimation.gif
Community,Every once in a while during storms we will get one washed up on the beach. It has been a few years since our last one!
Community,"Hi jeff. the use of spearguns, pole spears or hawaain slings is prohibited throughout the Bay Islands. with the recent invasion of the lionfish, the RMP has begun issuing licenses to both snorkelers and divers to hunt them. people interested can acquire a license and hunt year round, not just during derbies. anyone caught using a speargun, or using the lionfish pole spear for shooting any other species of fish, or using them on lobster with have their gear confiscated, be sent to jail and possibly receive a fine. please visit our office in west end for more information or email us at info@roatanmarinepark.net"
Community,"Deba Matherne, The facilities available on Roatan only cater to PET 1 bottles and drink cans and there is a return on the bottles and aluminum cans but it is very little. \n\nPlease do not forget that Honduras is in no way as advanced as the US no matter how many years ago you began gathering bottles for pocket change. \n\nWe are still a developing country and develop we must! \n\nHopefully you can imagine how hard it must be to collect recyclables for pennies a pound when you have no safe  place to sleep at night. These structures would provide sanctuary for many people not only in the US, where you might not see it as a viable option, but worldwide where there are people suffering due to lack of basic human rights. \n\nBrain surgery it is not but common sense would tell you that this is a great option for many people especially in countries where recycling is not even an option."
Community,National News Coverage!!  Great Job Bay Islands Coastal Clean Up and everyone that helped out!!! :) \n\nhttp://www.tiempo.hn/portada/noticias/islas-de-la-bahia-limpia-sus-playas
Community,Nick or Christie will be able to help you.
Information,Bracelet sales and business membership payments from dive shop operating within the Sandy Bay West End Reserve from Jan-Sep 2012
Community,We have 2 recycling receptacles available for anyone who wants one. Just drop by the office if your business wishes to promote recycling and grab one
Community,Anyone that will be in La Ceiba on Dec 5th should check this out!! 
Community,Dan Carr We will look into it! Eddie Nakada if it's been 2 years you are up for a renewal! Bryan R\xfcsell Neper Escalante have you completed the workshop already?
Community,"Interested in our whale shark population? Read this exert by Rachel T. Graham from the Gulf and Caribbean Research Vol 19(2), 149\u2013159, 2007 \n\nhttp://aquaticcommons.org/14033/1/Graham_GCFI_Pelagics.pdf"
Information,Sorry for the short notice but it was extremely rough on the south side this morning so we then released the juveniles in West End.
Information,A denuncia can be filed with the municipality and the sanitation department.
Action,"Hi Sheila Chastain, we have a membership program where people can name a dive site. For a $1,000 donation, you can choose a location and a site of a new dive site anywhere around the island   http://www.roatanmarinepark.com/become-a-member/membership-programs/"
Action,We are looking for a supplier of untreated pine  to build bee hive boxes and have been told that La Ceiba would be able to offer the best prices. Anyone out there have any contacts? \nWe are looking for 1x10 untreated pine.
Community,"Hi Amilcar, you can call me on 32856040. If you give us more information we can try find someone to help with this. Thank you!"
Information,Of all our members most of them will stockpile but of those that do not have the freezer capacity we know their suppliers and they are all frozen in season.
Community,"Well done Giacomo Palavicini, Executive Director of the RMP for helping to spread our great work and experiences across the Bay Islands. The workshop about 'Protocols and Complaints in the Bay Islands Marine Park was a great success! Thanks to UMA and BICA and CORAL's support for organising the event w in Utila town and the Cays! The participants Navy, Preventive Police, Municipal Police, local NGO, Sea Shepherd, Peace Judge and fisherman donated their time to be informed and shared their experience. Thank you all for doing such a great job and working together!"
Information,Read our latest newsletter and find out what the RMP has been up to\nhttp://www.roatanmarinepark.com/newsletters/2013/07-July.pdf
Action,"time is running out, send your photos in, maximum of 5 per person, for your chance for your photos to appear in the RMP 2010 calendar"
Community,"We would like to thank our latest Individual Gold Members, Linda and Loyal Quackenbush. They named their dive site ""Alice's Wonderland"" after their grand daughter. Located to the west of Deep Seaquest, the site is on a large patch sitting at 40ft and is just by the wall."
Information,Self Explanatory... :)
Action,"Heartbreaking but a powerful reminder of why we do what we do! To prevent things like this is why we work so hard and deal with so much stress! \nPlease support your local environmental NGOs, they are doing it for the greater good!"
Community,we will mail them... how bad do you want one? :)
Community,Share your creations!! Our baby is promoting Bay Islands Responsible Seafood!
Community,We want to thank the Port of Roatan for donating to the RMP a brand new Yamaha 115hp for our Chelsea Boat that patrols the area of Cordelia Banks. This donation will improve our patrols and bring safety and efficiency to our patrols and ranger. Thank You
Information,Just a reminder that there is  FREE Water Taxi and Shuttle back and forth from West End  to Banarama on Friday. Our birthday bash starts at 1pm but we will keep going until late so make sure you come along! https://www.facebook.com/events/785172788236227/
Action,Lionish Workshop this Wednesday at 4pm! Don't miss your chance to get a license to kill! Sign up today!
Community,Thank you Naomi Gittoes - Artist Page for this week's photo of the week!! It is beautiful!
Community,"Our candidates for Protect Our Pride, dive program for English speaking Hondurans, are doing great things! Last Friday Edgard Antunez a resident of Mud Hole and a tour guide at Upachaya organized a school presentation and beach cleanup! I think we are on to something here, ladies and gentlemen... Great Job to everyone that helped out! \r\nMore updates to come!"
Information,These are the bracelet sales and memberships of businesses on the southside and east end of January and February 2013... Thank you everyone for your support!
Community,Do you think this is true? Is it really on the decline or is this something to make us feel better about what is being done everyday!
Action,"Check back regularly to see the submissions for this year's photo competition.  Winners will be announced in August and featured in the 2010 RMP Calendar, which will be available in late Sept. \n\nNames of the submitters will not be shown prior to judging so as to not bias the results."
Community,"We would like to thank our newest Individual Gold Members Greg and Cris Buscetto who named their dive site Wicked Pissa after their favorite show Wicked Tuna. Located at the far end of Sandy Bay opposite Blue Harbor, the mooring sits in 35ft in a in a crack next to the shallows."
Information,Todas nuestras capturas se reportan a DIGEPESCA y en el caso de delitos ya graves a la FISCALIA
Community,"RMP Executive Director Giacomo Palavicini has been awarded a Sea Hero in Scuba Diving Magazine. The Sea Heroes Award recognises people of action, devoted to protecting the planet's oceans marine life through conservation. At the end of the year a panel of judges selects a Sea Hero of the Year! Keep your fingers crossed for Giacomo to win!"
Information,"People have been asking for a list of all the dive sites between Palmetto Bay and Key Hole near West Bay, so here it is with the GPS coordinates and depth of each site"
Information,Grouper's Last Stand
Community,"Si, cuanto necesitas?"
Community,"No, sorry. We have adrenaline, if that would help you!"
Action,Have some time after Semana Santa?? We will be having a beach cleanup on Tuesday the 2nd of April! \nContact Christi if you are interested in participating...
Information,To find out what we've been up to in November click on the link below\n
Action,follow the link and look at becoming individual members.
Community,Thank you to West Bay Divers... They took the initiative and tackled some of the trash that has been littering out beaches for the last few days. It's all one big bowl of plastic soup... 
Action,"You are invited to send 6 photos which can fall within any of the 6 categories. They must be taken by you, here on Roatan and underwater. Please attach a location, name and category for each photo submitted. The deadline is July 15th and all submitted photos will be available for viewing on facebook. The Best Find category will be judged by \u201cyou\u201d on facebook with the most votes winning that group. All other categories will be judged by independent adjudicators and the winners will appear in the 2014 RMP calendar."
Action,"FINALLY HAS THE 2010 CALENDAR IN STOCK AFTER WAITING ALMOST 2 MONTHS FOR DELIVERY, THEY ARE ONLY $15 SO IF YOU WISH TO PLACE AN ORDER, CONTACT US AT info@roatanmarinepark.net"
Community,"Perla Dive most of it had been taken to the dump. Donna Pieracini I guess not, is it bad up there?"
Action,"Has everyone got their 2015 black wristband or token yet? We are going to be sending some to the US soon, so if you are interested please email us to info@roatanmarinepark.net or drop into our ECO Store today! By buying these you are helping to protect the reef. Your contributions are really appreciated. Thank you!"
Community,"Our brother and former Park Ranger is now serving our country as a proud member of the Honduran Navy! \nGreat job Humberto, we are very proud of you!"
Action,We will be participating in a Coastal Cleanup this Sunday (8-11)!! Weather Permitting! \r\n We will be meeting at the Marine Park Office at 8AM! Please bring water and gloves if you have any!!
Community,Awesome! We will return the favour!!
Community,Maureen Connors we will meet at the Marine Park @ 8 and walk down together to the beach! :)
Community,Mangrove exploration field trip yesterday with NUNA Academy! \nThank you Miss Lorna and all the grade 7 & 8 students for allowing us to share our knowledge and passion for the island!
Action,We are looking for someone that can install our new POS system... \nKnowledge of Quickbooks is a must. We will compensate for your help...  :) Thanks
Community,Awesome shirt!!
Community,FINconceivable; What happens when sharks disappear? 
Information,Final count on LIKES= 97
Community,Andrea questo pesce \xe8 una passera (flounder)
Information,Press Release
Community,Reports have been streaming in about the abnormal amounts of trash littering the southside of the island. What do you think we can do about this? Tell us your ideas!
Community,please email us at info@roatanmarinepark.net
Community,"Roberto Mejia Astorga Just so you know, It has absolutely nothing to do with poor vs rich! It is not fishing that is illegal, it is the way they are fishing... Handlines (rod and reel included) are legal... Spears are not! Also, the fish that the sport fishers catch are open water, migratory fish (for the most part) that have no direct impact on the reef that so many of us rely on. So let's make that difference crystal clear and protect the reef!"
Information,Almost...
Information,Final count on LIKES= 24
Community,These turtles were found washed up on the beach a few months ago after the winds/currents changed (just like the last few days). This is why the alert is out for people walking the beach to keep their eyes open. \nRaymond Cass sorry they are at Maya Key in coxen hole. They run an animal rescue out there and would be more than happy to have you and your daughter come out.
Information,Looks like rain! http://www.wunderground.com/wundermap/?lat=16.31999969&lon=-86.52999878&zoom=8&pin=Roatan%2c%20&rad=1&rad.type=00Q&wxsn=0&svr=0&cams=0&sat=0&riv=0&mm=0&hur=0
Community,"We would like to thank our latest Individual Gold Members K. R. Prabha and Unmesh Wankhede who purchased a new site ""R & R's Easel"" which is located in front of the 3rd pallapa close to Pablos on the south shore near West Bay"
Information,"Photos from this year's Garifuna April 12th Celebration, which marks the arrival of the first Garifuna people to Central America and in particular Punta Gorda.  To see more updates on sustainable tourism and local culture. Click like on Go Blue Central America Geotourism"
Information,"This is great news! Imagine the impact from such a large city. Now let's do our part by continuing to reduce our consumption of single-use products and packaging.\nReduce, Reuse, Recycle."
Community,MANGROVES are our best natural filters and we need to restore them now with joint efforts because of all the reasons this video shows.
Information,"DO NOT VOTE ON THIS ALBUM! Please note that this is not the album that will be open for LIKES. We will post a new album shortly of the top 20 photos chosen by the RMP staff based on how rare and unusual the find actually is. We will then be asking you, our friends and members, to vote on your favourite of those 20! \nPlease keep your eyes and ears open as LIKING will only be open for ONE WEEK!!!"
Community,Congratulations to all winners!!!!
Community,"Thank you Eric Addicott for this prize winning photo, He came 3rd place in our Divers category in our Photo Competition!!  Check out this photo and others in our 2015 calendar!"
Information,Awe inspiring message... 
Community,Support Earth Hour by using free school action kit (presentations and slideshows) found at!\nhttp://earthhour.wwf.sg/2014/schools/\nand create and register an event in your town with a starter kit by clicking the link:  http://www.earthhour.org/earth-hour-starter-kit 
Information,"We had a great day at Punta Gorda yesterday celebrating and learning more about local cultures, a key theme in sustainability. Take a look at this video to learn a bit more about what it was all about."
Action,"The RMP is looking for 3 MSDTs to help out with a Junior Park Ranger program for 5 weeks starting in July. Each Instructor will be teaching 5 local kids OW, NAV, PPB, Fish ID and NAT specialties PLUS EFR.  We are also looking for diveshops that will help us accommodate the groups. \nTHESE ARE PAID POSITIONS! \n\nMSDTs MUST: \nHave, at least,  intermediate Spanish\nLike kids \nBe patient\nFun Loving and Creative\nBe NAV, PPB, Fish ID and NAT specialty Instructors \n\nPlease send CVs to christi.etches@roatanmarinepark.net and christianne.etches@gmail.com"
Community,"That's a good question Kirsty Doig, We'll check it out!"
Information,Please keep in mind that we have had many great movements and conservation efforts on Roatan this year! There are some great opportunities for photographers to submit photos into the Conservation in Action category of the 2014 Photo Competition such as: \n\nThe supermarket's initiative to reduce the amount of plastic bags on the island.\nThe launch of the Go Blue Central America Geotourism website that promotes over 80 businesses island wide.\nThe Bay Islands Coastal Cleanup initiative or any beach/coastal cleanups around the island. \nThe community based patrols that are happening around the island. \nLocal Divers! \nLocal community businesses that are choosing an alternative to fishing and exploiting the reef! \n\nIt is a bonus category that should spark your creativity! There is conservation in action everyday and no limits to how many photos you can submit!! \n\nHappy shooting and keep the great photos coming!!
Action,"The cost is $50 for divers or snorkelers and includes the spear, the course, paperwork and the license. I am conducting one this afternoon at 4pm in West End for free divers"
Community,Let see how we do on captions... Caption Needed! 
Information,"San Simon, West Bay"
Community,"Yes, we have an english version which will also be uploaded"
Information,"DO NOT VOTE ON THIS ALBUM! Please note that this is not the album that will be open for LIKES. We will post a new album shortly of the top 20 photos chosen by the RMP staff based on how rare and unusual the find actually is. We will then be asking you, our friends and members, to vote on your favourite of those 20! \nPlease keep your eyes and ears open as LIKING will only be open for ONE WEEK!!!"
Action,Only a week left until closing of the photo competition. Please send your entries in soon to have your chance to have your pictures in the 2012 RMP calendar
Community,"Thank You to everyone that came out and all the businesses that donated material and services on Sunday!! \r\nEspecially the West End Patronato, South Shore Canopy, Sundowner's Beach Bar, CORAL, CEM, Argentinean Grill, Buena Vida, Cafe Escondido, Waves of Art, Guatemalan Gift Shop, Coconut Tree Divers, Enomis Divers, Ocean Connections and West Bay Divers."
Community,"Hi Dian, it's $8 for one."
Community,Wouldn't this be amazing?
Community,Photo of the week!!
Community,"As vote by you, our supporter, member and friend this Flying Gurnard has won 3rd Place in our BEST FIND Category! Congratulations @Jennifer Keck Hutton!"
Community,Conservation pumpkins from around the world! Thank you Anthony Davis for your amazing carving!
Information,"We were able to install 4 fishing moorings around Cordelia Banks. Part of an extensive marine infrastructure funded by CORAL and Port of Roatan, the RMP has also installed snorkel moorings and demarcation markers."
Information,Please don't step on meee!
Information,learn more about our problems with the lionfish and how we are combatting the problem
Information,Our little buddy at Maya Key! Gonna have a few months of rehab then back into the real world!! 
Community,We recognize that effort.
Information,"Last week our director was on the Atlantic coast of Guatemala in conjunction with Healthy Reefs Initiative, DIPESCA, Fundacion Mundo Azul and Waterquest dive shop teaching local fishermen the importance of sustainable fishing. \nThere was a strong emphasis in shark fishing/overfishing as it is the number one income for many coastal communities. \nFishermen were also taught how to monitor their waters by being trained in AGRRA (Atlantic Gulf coast Rapid Reef Assessment)\nMarine protected areas Sarstun and Punta de Manabique are our closest protected neighbours and have a direct impact on us and us on them.\nThe time spent was essential for the protection of the entire Mesoamerican Reef Region. The sooner we realize and understand that we are all connected and impacts are not localized the better off we will all be!"
Action,"Check back regularly to see the submissions for this year's photo competition.  Winners will be announced in August and featured in the 2010 RMP Calendar, which will be available in late Sept. \n\nNames of the submitters will not be shown prior to judging so as to not bias the results."
Information,"Now all the pictures are labelled you will understand them. All live conch, fish and lobster are returned to the water. Sadly anything which we were unable to prevent people from killing are returned to the sea so other animals can benfit from their loss"
Information,The August newsletter is now available at\nhttp://www.roatanmarinepark.com/newsletters/2010/08-August.pdf
Information,They were very happy to get to the sargassum! They immediately started lounging and floating in their temporary home!
